为了明年PB是时候冬训了 16周精准备赛计划请查收,对于还没有参加过马拉松的跑者，是否打算开始准备人生第一场马拉松呢？小编想说，对于跑者而言，是时候开启自己的冬训备赛了。夏练三伏冬练三九，主要是指利用酷热和严寒时节，在严酷的环境下进行训练：一方面：这个季节马拉松赛事较少，可以有充分的时间系统地提升自己的跑步能力，有效提高耐力，增加体能储备；一方面：冬季充分地磨练自己的意志品质，在这样严苛的环境下都能很好的跑步训练，那么可以想象，当进入舒适的春季，信心满满地参加一场马拉松自然不在话下。也就是说，利用好冬季，比较系统地进行跑步训练，那么当春季来临，你会发现自己成绩大踏步前进，这就是冬训给你带来的脱胎换骨的变化。当然，对于身处南方的跑者来说，冬季不冷不热，这个季节恰恰是十分舒适的备赛时节，此时不练更待何时？为健康而跑步你只需要保持规律地适量跑步就足矣，而为了马拉松比赛而跑步，除了坚持，你还需要更加系统全面的训练。因为马拉松比赛是长时间高强度的极限运动，同时充满了很多不确定性的，如果你没有足够的能力储备，那么抽筋、撞墙、受伤、退赛将极有可能发生；即便你拼尽全力挣扎着达到终点，即使你被坚持、信念等溢美之词裹挟，这种不太愉快的体验也只有自己打掉牙往肚里吞。如果你不想那么不堪地完成比赛，如果你想健康无伤、不那么痛苦地完赛，亦或是在在比赛中PB，那么系统科学地备赛就显得至关重要。我们常说的一句话是“没有金刚钻别揽瓷器活”，没有足够训练、没有足够跑量就不要轻易尝试马拉松。那么，究竟需要经过多长时间的准备才能参加马拉松呢？1、备赛时间● 从科学角度出发对于初次跑马者而言参加全程马拉松前需要具备8~12个月的持续性系统训练；对于已经参加过马拉松且长期坚持跑步的资深跑友，至少也需要6个月的系统训练，最短备赛时间不得少于3个月；● 如果你计划参加半程马拉松对于初次跑马者而言，需要持续性系统训练3~6个月，对于资深跑友，至少也需要2个月的系统训练，最短备赛时间不得少于1个月；2、备赛跑量● 为全马而备赛，理想月跑量应当达到250-300公里，多一些相对更好，至少也需要达到180-250公里；●  为半马而备赛，理想月跑量应当达到180-250公里，至少也需要达到120-180公里；●  跑全马前的1-2个月至少应当跑过一次30-35公里；跑半马前的1-2个月至少应当跑过一次10-15公里；冬训备赛最科学严谨的你要用周期训练的思想为自己制定训练计划。什么是周期训练？它是由前苏联著名运动训练学专家马特维耶夫（Matwejew）在20 世纪60 年代中期提出了著名理论。他认为人体竞技状态不可能一直处于良好状态，而是具有周期性、阶段性的规律，在备赛初期往往运动量比较大，但强度较低，到备赛后期，则减少运动量，突出运动强度，这样就能不断提高能力，最终让最佳状态出现在比赛的时候。初步了解了周期训练理论，跑友们应该就大体明白了，原来每天坚持跑步，每天只做LSD训练基本只能属于锻炼的范畴。而想要在艰苦的马拉松比赛中健康无伤的完赛或者PB，就得用周期训练的思想，系统地、以一定逻辑、循序渐进的开展训练，这样才能确保经过训练，能力得到实实在在地提高。想要更高效的进行马拉松备战，除了积累必要的跑量，金字塔训练是最佳模式。所谓金字塔训练：就是要把不同配速的训练有机组合，轻松跑位于塔基，表明其是训练的主体，但是不能只有轻松跑，再往上是马拉松配速跑、乳酸阈跑、间歇跑和冲刺跑。速度越慢的训练，往往安排在备赛初期，占的跑量大，而速度越快的训练，往往安排在备赛中后期，占的跑量越少。不同速度的跑法合理安排，就可以全面发展人的体能能力，从而帮助你真正高效地备赛。所以，如何安排接下来大约3-4个月的训练也就成为备战上半年跑马季的重中之重。一般来说，为一场马拉松比赛进行认认真真地准备，需要经历四个阶段。依次为基础期→进展期→巅峰期→竞赛期。马拉松备赛四阶段之所以将训练划分为四个阶段，目的是通过循序渐进的训练，从不同方面对全马跑者所需要的能力进行刺激，以达到全面提升跑者水平的目的。那么每个阶段的训练意义和目的又是什么？（手机斜90°查看图片）1、基础期训练这一阶段对于全体跑者来说非常重要，很多跑者在跑步的前期都能够快速提升耐力，并且不会出现较为严重的运动损伤，但是随着训练时间越来越长和训练越来越频繁，将会遭遇瓶颈。基础期训练的主要目的：就是为即将到来的赛季奠定良好的基础，在该阶段主要是发展身体的有氧能力，防止在比赛中出现撞墙现象。这一时期主要利用低强度，长距离训练强化身体机能，尤其是让下肢肌肉肌腱逐渐得到强化，避免后期因跑量增加和配速提升带来运动损伤。这一时期的跑者，无论是心肺还是肌肉亦或是从跑步经济性来看，都处于一个相对比较薄弱的状态，所以训练以低强度慢速跑为主，让身体有一个逐渐适应的过程。——基础期训练要点● 训练强度可控制在平时跑LSD时的强度，一般为最大心率的65%~78%；● 训练频率在每周3~4次，隔天一次，周末可安排一次长距离LSD拉练；● 每次的训练时间在30~150分钟之间；● 在长跑中途可以穿插多组15秒左右的冲刺跑，用以发展速度能力，这样可以平衡有氧和无氧训练，消除LSD训练的副作用，如导致节奏变慢，心肺趋于适应；2、进展期训练经过基础期训练，跑者的有氧能力已经形成，身体已经得到强化，之前LSD训练为身体所带来的收益已经在逐渐递减。此时，在训练中需要加入新的刺激才能进一步提升整体的跑步能力。而最大摄氧量能力的提升在该阶段将变得尤为重要，最大摄氧量的提升可以很好地为后期大强度训练提供保障。所以在该阶段主要是在进一步提升跑者有氧能力的情况下加入能够对自身的最大摄氧量进行一定刺激的间歇训练，通过间歇训练一方面让一组训练导致的疲劳得到一定程度恢复，同时又不让疲劳完全恢复就进入下一组训练，以进一步提升我们的有氧代谢能力。进展期并不代表该阶段只进行间歇跑，该阶段仍然要保持足够的轻松跑，轻松跑与间歇跑的月跑量比例大约为8：2。比如☟你的月跑量是200公里，那么间歇跑总跑量可以达到40公里，这里可以每周平均分配，也可以根据身体条件以及训练情况，在某2-3周集中进行。3、巅峰期训练经历了前两个阶段的训练，跑者身体处于一个相对来说比较良好的状态，此时如果想提升比赛时的配速，那么就需要训练其在高配速下抗疲劳的能力。在高配速时，乳酸生成增多，身体就会开始进入到疲劳状态，如果将配速正好保持在乳酸产生量与分解量相等的那个区间内，那么跑者将会以最快的速度进行奔跑，而且能够避免身体因乳酸堆积而造成的疲劳。久而久之，临界速度就会跟着提升，有氧区间也会跟着扩大，配速也会相应进行提升。——因此，巅峰期训练以乳酸阈跑为主：● 训练强度：以最大心率的89%~92%进行训练，如果配速达到要求了，但心率较高，那么应当降低强度，以心率为准；● 训练时间：连续至少奔跑20分钟。如果你觉得刚开始强度太大，可以把一次训练拆分成几次来做，每次的训练时间介于5~20分钟之间，训练和休息时间比为5：1。如今天乳酸阈跑的训练时间为40分钟，可以采用训练20分钟休息4分钟，再跑20分钟的方法，也可以采用，跑4个10分钟每组组间休息2分钟的方式进行；● 同样的道理，在巅峰期除了乳酸阈跑，轻松跑、间歇跑同样要继续保持● 轻松跑：乳酸阈跑：间歇跑的月训练量比例为5：3：2；4、竞赛期训练该阶段的训练应当紧紧围绕比赛和适应比赛展开，此周期为了让体能达到巅峰状态，并适应比赛的强度，为即将到来的比赛做好身体和心理上的准备。——该阶段应当加强马拉松配速跑训练，从而适应马拉松专项强度：● 训练时间：马拉松配速跑的训练时间控制在40分钟~110分钟（1小时50分钟）；● 训练强度：心率控制在最大强度的80%~88%，以马拉松比赛PB目标或略低于PB目标的配速进行训练，以充分掌握比赛速度节奏；● 该阶段还可需要配合适量的乳酸阈跑以及轻松跑；● 轻松跑：乳酸阈跑：马拉松配速跑的月训练量比例为5：3：2；对于广大跑者而言，要为自己制订一份系统的马拉松备赛计划显然颇有难度，而市面上大多数训练计划无法提供精细的配速、训练量指导，无法实现个性化和精准训练。距离明年的3月22日无锡马还剩16周，不知道大家是否已经开始备赛？训练进展怎么样了？（慧跑）
年终收官之战 请收好这份2019广州马拉松参赛攻略,还有4天，年终马拉松收官大战-2019广州马拉松即将鸣枪开跑，作为双金赛事+国内大满贯赛事+阿迪参赛服及六福珠宝完赛奖牌，广州马拉松赋予了跑友无限的期待，2019年12月8日，广马7年，如期而至！关于领物，看这里2019广州马拉松领物地点依旧设在广州琶州展馆，距离领物点最近的地铁站为地铁8号线琶洲站，建议选手乘坐地铁前往领物点，另外广马已在周五延迟领物截止时间，请本地跑友尽量选择周五错峰领物哟~领物时间：12月5日（周四）：9：30-16：3012月6日（周五）：9：30-19：3012月7日（周六）：9：30-20：00（特别注意：2019广州马拉松参赛物品领取须本人持报名时所用有效身份证件原件前往领取地点，不可他人代领）广州南火车站/广州站：建议乘坐地铁2号线，至昌岗站换乘地铁8号线（万胜围方向）至琶洲站，出站口步行直达领物点（约50分钟）。广州东火车站/广州白云机场机场：建议乘坐地铁3号线北延段，至体育西路站换乘地铁3号线（番禺广场方向）至客村站，换乘地铁8号线（万胜围方向）至琶洲站，出站口步行直达领物点。广马博览会惊喜依旧2019广州马拉松参赛装备包含：阿迪达斯参赛服一件、参赛包一个、号码簿、盐丸、康师傅牛肉面一盒。另外在领物结束后，广州马拉松依旧设置了赞助商博览会，但博览会展商规模相对北京马拉松和上海马拉松略小，现场可继续薅羊毛。比赛当天，如何到达起点2019广州马拉松比赛起点依旧设置在天河体育中心，参赛选手可乘坐地铁1号线或3号线至体育西路站，或APM线至林和西站下车，步行前往赛事起点。（注意：比赛当天早晨体育中心南站将不停站）另外特别注意的是2019广州马拉松将采取分枪起跑的方式，马拉松选手将于7：30开跑，半程马拉松选手将于8：00开跑，请参赛选手务必进入正确分区起跑，否则成绩无效。比赛线路不变，留意赛道提前解封2019广州马拉松继续延续经典的比赛线路，起点为天河体育中心，全马选手将途径猎德大桥、琶洲展馆、广州塔、滨江东、海珠桥、花城广场等广州标志性地标，而半马选手终点设在广交会展馆北广场。值得留意的是，往年广州马拉松全程均出现了赛道提前解封的尴尬，去年甚至在25公里就解除封路、30公里提前十多分钟拆掉计时毯、关门兔一起被关门，所以请参赛选手务必留意今年广马赛道解封等情况是否和官方公布相符。比赛天气晴朗，温度适宜根据目前的天气预报显示，2019广州马拉松比赛当天晴，气温为10-22度，整体气温较为适宜，有利于选手奔跑。完赛奖牌继续镶金，真香2019广州马拉松全马完赛奖牌继续镶金（半马不镶金），另外选手在完赛后还可获得赛事完赛物资一份。2019年12月8日，广州马拉松年终奔跑，如期而至，你准备好了吗？（马拉松报名）
为保命放弃比赛美女哭的梨花带雨 上收容车也优雅,冲过终点线，这是每个马拉松赛事选手的目标。然而，每场比赛都有不少在赛事规定关门时间未能撞线的选手。伴着冬日暖阳和飞翔的海鸥，2019上合昆明马拉松在昨天鸣枪开赛。一名女选手在坚持了一小时后，上了收容车。昆明市中心海拔约1891米，大部分地区海拔在1500至2800米之间，通常中度海拔高度为1500到2500米，所以此次马拉松算是亚高原跑马。“为了保住小命不得不弃赛，但是上了收容车以后上吐下泻的症状更具体，强忍坐了五个小时后整个人都虚脱了。”在收容车上，这位美女手捧热饮，眼角湿润，让人动容。不少人认为，马拉松上收容车很丢脸。其实，在坚持和放弃之间，放弃也需要很大的勇气。弃赛和坚持完赛一样都值得我们尊重。人生也如一场马拉松赛，但人的生命仅有一次，所以人生马拉松没有第二次机会！每个人都不可能说放弃这一次的人生征途，幻想着去寻求下一次重新开始。在上个月的重庆女子半马，有位姑娘单手掩面，先是仰头流泪，后来又席地而坐，埋头痛哭起来。被“关门”未能完赛，这位哭得梨花带雨的姑娘引起跑圈热议。姑娘名叫冉红霞，27岁，是一名小学教师，2018年开始跑步。2018年3月是她第一次参加跑步比赛，去年重庆女子半程马拉松赛，均顺利完赛。冉红霞表示，当天自己跑之前吃了一点面条，前5公里的状态很不错，因为早上没有喝水，因此在补给点喝了些水，“谁知道肠胃开始痉挛，不舒服，只能压着跑，速度非常慢，一旦快起来就特别难受。”“之前也想过跑不动了就放弃，但真到了那个时候，无论如何都是不甘心的，想着过一会就能缓解。”但冉红霞表示，一直慢慢跑到最后5公里仍然疼痛不止。“明知道会超时了，收容车也在旁边跟我招手，看到只有两三百米了，旁边的小哥哥举着牌子告诉我比赛关门时间到的时候，我实在忍不住崩溃了，心里特别难过。”自己报的马，哭着也要跑完。前年广州马拉松，一位身穿红色紧身短袖，下身黑色压缩裤的姑娘在赛道上边跑边哭，不知道是因为42公里的赛道太虐，还是跑步的途中想起了什么伤心往事，痛苦的表情让人心碎。人生要懂得坚持和放弃。经常参加的马拉松的人常调侃，没有上过收容车的马拉松是不完整的。你上过收容车吗？（跑马去旅行）
涨报名费才能走更远？算一算马拉松的经济账,近年来，国内各地的马拉松赛事氛围依旧火爆，作为城市活力的全新带动方式，体育赛事——尤其是城市马拉松——对推动城市的经济、基础设施建设和文化的发展有着越来越重要的作用。在2019年初的中国马拉松年会上，中国田径协会公布的数据显示，去年全国举办的800人以上规模马拉松及相关赛事共计1581场，累计参赛人次583万。全民参与程度依旧保持在较高水准的当下，2018年的马拉松年度总消费高达178亿元，带动总消费288亿，年度总产出746亿元，所有的数据似乎都在进一步烘托路跑市场的火热和“壕气”。然而作为运营方，要举办一场马拉松并不是那么轻松的事情，需要经过数月乃至数年的精心准备，包括但不限于设计路线、用尽浑身解数去招商引资、在体育交通安保医疗环卫媒体等业务口之间长袖善舞、在物资场地设备等做到万无一失，对不同岗位的志愿者和现场工作人员进行高标准培训，烧脑挖掘设计赛事特色并进行包装推广宣传，绝对保证赛事安全有序，最终要让跑者获得良好的参赛体验，让各路赞助商获得满意的商业回报，为举办地产生理想的广告效应并带来旅游餐饮等行业的经济效益……然而，要打造这样一场各方都满意的马拉松赛事，必须有充足的经费做支撑。当前国内马拉松赛事的经费主要来源是政府通过政策和资金两方面的扶持，然而随着赛事通过良好的服务、超值的性价比获得了跑友和市场认可后，想要实现可持续发展，再像过往一样由政府将财政资金用于补贴马拉松运营成本就显得不合时宜了，用商业资金和社会资金支撑办赛成本才是成熟赛事运营的大趋势与发展方向。国内赛事中，商业开发最成功的无疑是北马，北京马拉松2019年参赛人数30000人，每名选手的报名费200元，倘若不考虑赞助商名额及一些免费名额的因素，赛事的报名费收入仅600万。虽然金额不低，但与一场3万人的马拉松需要的成本相比只能说还是显得单薄。而北马从官网上可以看到有22家赞助商，提供的各方面的权益，让北马在商业化上走的更远，能够实现自身的盈利，但并不是所有的马拉松都可以依靠赞助金额来覆盖成本，更多的赛事还处于运营初期，赞助商的赞助金额有限，而作为主要收入来源之一，报名费无疑是一个收入的增长点。既然市场化运营是大势所趋，那么各个环节的市场化定价同样是必然的。因此，合理的价格——不论是赞助商权益列表，还是报名费，不仅是供求关系的体现，而且是对消耗各类资源的必要反映——尤其是在考虑到自然资源耗费和生态环境影响的条件下。第一，在供求关系中，需求越是旺盛，价格上升空间越大；第二，价格必须反映出办赛消耗各类社会资源的真实成本。从跑者体验出发，越是周全细致的赛事服务，越是精益求精的物料供应，就越是需要投入庞大的各类优质资源，而优质资源的成本是刚性且难以改变的，你能看见的，比如租用更大会展场地和更多流动厕所、发放质量更好的参赛服和含有更多贵金属的的奖牌、在会展和赛道上加派更多更有经验的志愿者、安保急救力量、摄影师和分拨更多饮食降温物资；你看不见的，比如为辛苦的急救人员和警察购买菜量更大营养搭配更合理的盒饭，雇请更多清洁工人加快赛后清理，邀请更多重量级的媒体，制作更精美的影像素材等等。这自然也对应着更合理的价格。对比国内一些“0元中标”的赛事组委会，报名费始终处于低价，但它们提供的赛事服务质量、赛事本身市场开发程度都与国内大型赛事有着显著的差异。这自然说明了在一场赛事长时间的留存于中国马拉松之林时，为跑者提供的服务，以及自身进行市场开发，都是其中的关键要素，低价吸引人气的时代已经进入到末期了。著名跑者、媒体人、前新浪高级副总裁魏江雷曾表示，跑者在占用大量社会公共资源的当下，享受着“超值”的服务，应该要支付更加对等的费用，来“回报社会和城市”，因此他曾建议北马涨价到500元。消息一出立即引发全网热议，观点迅速分裂为两派：一派声音表示可以接受涨价，毕竟是一个市场的行为，其中更是结合到当下生活必需品的物价相较于前几年都有了攀升；另一派虽占少数，但其观点认为城市和赛事需要拿出更大诚意来满足跑者需求。英国《金融时报》曾将跑步定义为“中国中产阶级的新信仰”，在一身跑步装备动辄几百、几千，往返比赛地交通成本同样高昂的情况下，几百元的报名费对跑者而言恐怕也只是凤毛麟角罢了。如今，马拉松赛事已经过了野蛮生长的时期，政府搭台，市场唱戏是马拉松赛事的全新时代，自负盈亏毫无疑问将成为赛事运营的主要经营模式。在这个时期已经成熟的赛事想要确保赛事品牌持久、创新的传承和发展下去，需要从品牌定位、品牌推广和品牌延伸三大角度来重新审视和布局。全面开发赛事的市场价值，让国内的马拉松最终能够在盈利的基础上反哺城市，而不再如今日被冠以“泡沫”之名。
莫法拉刚刚宣布回归奥运会 欧洲马拉松纪录被打破,近日，莫法拉在一段采访中透露，自己将在明年奥运会中复出，会继续征战万米的比赛。2017年伦敦田径世锦赛，主场作战的莫法拉拿到了10000米的金牌、5000米的银牌，他就此功成身退，开始转战马拉松赛场。他在2018年的伦敦马拉松上获得了第三名，并在当年的芝加哥马拉松中跑出2小时05分11秒的成绩，获得冠军的同时，也打破了欧洲马拉松的纪录。今年，莫法拉再次跑了伦敦马拉和芝加哥马拉松，但这两场比赛他的成绩平平，没能继续突破，他也因为跑芝马，从而放弃了多哈田径世锦赛。上个周末，在瓦伦西亚举行的一场马拉松赛中，来自土耳其的选手Kaan Kigen Ozbilen，跑出2小时04分16秒的成绩，一举打破了莫法拉的欧洲马拉松纪录，并首次跑进205大关。（kyrie）
演员郑恺10公里跑进1小时 这波是什么水平？,今天傍晚，演员郑恺在微博晒了一个跑步卡，10公里用时58分，平均5分48秒的配速。郑恺的跑步记录来源于佳明手表，从跑步轨迹来看，他是从南浦大桥边的滨江公园入口出发，沿着公园的跑步道一直跑了10公里。今天傍晚上海的气温在10度左右，他则穿着长裤长袖的装备。郑恺还特别晒出了自己每公里的配速，他的起步较慢，前5公里用时30分18秒，从6公里开始加速，飙出5分25秒的配速，后面5公里则用了27分49秒，平均5分33秒的配速。这是一次典型的负配速尝试，10公里跑进1小时，郑恺自己显然也很兴奋。网上的公开资料显示，郑恺在高中时考取了国家二级运动员证，他的短跑十分出色，即使后来开启了演艺生涯，他还是保持了运动的习惯。为了保持身材，郑恺平时经常光顾健身房。跑步机跑步。举铁深蹲。俯卧腿弯举。户外跑步。去朝阳公园刷小怪兽。在追我吧的录制中，穿上专业李宁䨻跑鞋。还与徐洁儿的俪量跑团一起约跑，他的跑步日常简直和普通跑友一模一样。对于跑友郑恺，你如何评价呢？（kyrie）
冲击大满贯信心十足！2019新加坡马拉松结束3天赛程,新浪体育讯 （2019年12月1日） – 上周末，随着第18届渣打新加坡马拉松赛（SCSM）系列赛事陆续收官，成功将跑步界的目光都聚焦在了新加坡， 为跑者带来了世界级的跑步体验。周日上午进行的5K和10K，是新加坡马拉松系列赛的最后一个赛程。从周五晚上的儿童短跑开始，然后是周六晚上的特色半程马拉松和马拉松比赛，截止到周日的5K10K，共有来自133个国家的5万多名选手参与其中。新加坡马拉松首次改在晚上起跑，全新的三天赛程设计，在参赛者和观众中受到好评，他们可以欣赏到新加坡美丽的城市景观和夜生活。通过与政府当局以及合作伙伴的协作，主办方将年度盛会带入了下一个时代，朝着加入著名的雅培世界马拉松大项（AbbottWMM）的目标迈进，向着世界上最大、最知名的马拉松赛事联盟努力。雅培世界马拉松大型马拉松赛执行主任蒂姆·哈齐马说：“我们的团队很高兴能回到新加坡。看到到晚上的活动和团队继续取得的进步，真是太棒了。与往年一样，我们的评估团队将花时间审查汇报，根据标准评估相关活动领域。我们非常期待与渣打新加坡马拉松赛继续合作。”2019新加坡马拉松在观众体验方面着重发力，让参与者家人、朋友和各国观众都享受到这一系列比赛魅力。（sama）
2019上合昆明马拉松鸣枪开赛,
Joshua Cheptegei打破10公里世界纪录,
