国行版Switch将于12月10日正式发售 售价2099元,新浪科技讯 12月4日午间消息，腾讯携手任天堂宣布，腾讯引进Nintendo Switch将于12月10日正式发售。国行版Nintendo Switch为续航增强版且预装《新 超级马力欧兄弟U 豪华版》体验版，官方建议零售价2099元，腾讯同时表示Nintendo Switch Lite的引进工作正在筹备中。游戏阵容方面，发布会上表示，未来数周内会陆续把Nintendo Switch上的精品马力欧相关游戏带给中国用户。率先到来的是《新 超级马力欧兄弟U 豪华版》，官方建议零售价299元，12月10日在Nintendo e商店正式发售，游戏兑换卡将会随后发售，实体游戏卡带将会在明年春节前后发售。《马力欧卡丁车8 豪华版》和《超级马力欧 奥德赛》会在未来数周内陆续推出，官方建议零售价均为299元。除主机和游戏之外，本次发布会亦公布了amiibo™婚礼造型系列游戏互动模型，多种配色Joy-Con™、Joy-Con充电握把、Joy-Con方向盘、Joy-Con腕带，Nintendo Switch专业手柄、Nintendo Switch电源适配器、Nintendo Switch基座套装、Nintendo Switch充电支架、Nintendo Switch便携包等多款官方配件。售后服务方面，腾讯和任天堂承诺将为用户带来便捷的售后体验。在任天堂的技术支持下，国行版Nintendo Switch主机可获得由腾讯提供的一年官方保修服务，任天堂丰富的官方周边产品也将享受对应的三包服务。网络服务方面，通过腾讯设立的本地化网络服务，用户可以享受更便捷和顺畅的游戏体验。在任天堂的支持下，腾讯还优化了Nintendo Switch内置的“Nintendo e商店”，让用户可以通过微信支付来购买喜欢的游戏。腾讯集团高级副总裁马晓轶表示，秉承着腾讯游戏全新的品牌理念，“去发现，无限可能”，腾讯将会通过Nintendo Switch 让更多的中国消费者感受到“随心切换，一起趣玩”的快乐和无限可能，让游戏成为亲人朋友之间沟通的重要桥梁，帮助年轻人培养起健康的游戏观和游戏审美。任天堂株式会社代表取缔役、专门领域开发主导宫本茂表示，在任天堂的游戏和主机开发中十分重视给用户提供全新且有趣的体验，同时更加重视让家人可以欢聚一堂，一起玩乐，致力于为消费者提供无论是谁都简单易懂、可以使心情变得愉快舒畅的游戏。任天堂株式会社取缔役、专务执行役员高桥伸也还表示，《Mario Tennis Aces》《Super Mario Party》《Kirby Star Allies》《Yoshi’s Crafted World 》《Pokémon Let’s Go！Pikachu/ Pokémon Let’s Go！Eevee》和《The Legend of Zelda：Breath of The Wild》也都在积极筹备中。
国行Switch低调发布：续航增强版2099元,新酷产品第一时间免费试玩，还有众多优质达人分享独到生活经验，快来新浪众测，体验各领域最前沿、最有趣、最好玩的产品吧~！下载客户端还能获得专享福利哦！今天上午，腾讯悄然召开发布会，正式公布了国行Switch，续航增强版售价 2099元，12月10日开卖。根据极客之选的介绍，任天堂新世代游戏机将于12月4日开启预售，12月10日开卖，续航增强版售价 2099元。游戏方面，任天堂 Switch 国行版的马力欧系列游戏将很快登陆，《超级马力欧兄弟U 豪华版》售价299元，12月10日开卖。《马力欧卡丁车8 豪华版》售价299元，《超级马力欧奥德赛》售价299元，两款游戏将于未来几周内开售。除此之外，《艾希》、《中国式家长》等国产游戏也将上架。
2018年我国区块链专利超1200项 数量全球最多,来源：我国区块链专利超1200项数量全球最多国家知识产权局专利审查协作天津中心电学部电子工程室主任王琳介绍，在区块链领域的专利里，主要分为支撑技术和技术应用两大方向。“2011年，全球范围内才开始出现与区块链相关的专利申请，直到2015年才开始进入迅猛发展期。”截至2018年，我国拥有超过1200项区块链专利，在数量上处于世界第一。
最高法:互联网司法尚处探索阶段 推动制定电子诉讼法,原标题：最高法：互联网司法尚处探索阶段，将推动制定电子诉讼法互联网司法制度总体框架已初步搭建完成，最高法将推动立法机关制定专门的“电子诉讼法”。12月4日，《中国法院的互联网司法》白皮书（以下简称《白皮书》）对外发布。最高法院副院长李少平介绍，这是中国法院发布的首部互联网司法白皮书，也是世界范围内首部介绍互联网时代司法创新发展的白皮书。澎湃新闻注意到，2017年8月18日，我国设立全球首家互联网法院——杭州互联网法院；2018年9月，又先后增设北京、广州互联网法院。2018年9月，最高人民法院制定印发《关于互联网法院审理案件的若干问题的规定》，有效明确了身份认证、在线立案、电子证据、在线庭审、电子送达、电子卷宗等在线诉讼规则，为完善在线诉讼程序和规则作出了有益探索。“目前，互联网司法制度的总体框架已初步搭建完成。”李少平表示，三家互联网法院和各地法院陆续制定出台诉讼规程、诉讼指南、审判手册等文件，细化在线审理规程、明确在线诉讼规范，有力推动在线诉讼规则体系逐步完善，实现互联网司法实践成果有效转化为程序规则和长效制度。目前，互联网法院大多数案件当事人足不出户即可完成诉讼，实现诉讼流程从“线下”到“线上”转变。“即使在已经实现全流程网上审理的三家互联网法院，根据案件情况和当事人需求，仍然可以提供灵活便捷、可转换的线上线下混合诉讼机制。”最高法院司改办主任胡仕浩透露，截至目前，三家互联网法院约有9%的案件是通过线上线下混合模式审理结案的。胡仕浩表示，互联网司法建设尚处于探索阶段，目前传统法院和传统诉讼模式仍是解决纠纷的主要渠道，对于不会使用、也不想使用互联网打官司的老百姓，完全可以按照传统模式，进行全流程线下诉讼，“条件成熟时，我们将推动立法机关制定专门的‘电子诉讼法’，实现诉讼制度的创新与飞跃”。值得一提的是，各地法院还广泛运用大数据、云计算、人工智能、区块链、物联网等前沿科技，全面推进信息技术在司法中的深度应用。在区块链领域，“人民法院司法区块链统一平台”，完成超过1.94亿条数据上链存证固证，利用区块链技术分布式存储、防篡改的特点，有效保障证据的真实性，极大减轻法官认定证据的难度。在大数据领域，“人民法院大数据管理和服务平台”可实时汇集全国3507个法院的审判执行、人事政务、研究信息等数据，2019年10月31日，已汇集全国法院1.925亿案件数据，目前已成为全世界最大的审判信息资源库。在人工智能领域，各地法院积极开发了各类智能化审判辅助系统，不同程度实现案件繁简甄别分流、案件智能画像、庭审自动巡查、法条及类案精准推送、自动生成文书、文书瑕疵自动纠错、裁判风险偏离度预警等功能，成为法官办案和群众诉讼的有力辅助。
