两位联合创始人双双卸任 47岁皮查伊执掌Alphabet,原标题 谷歌两位联合创始人双双卸任，47岁皮查伊正式执掌Alphabet记者 孙文豪美国当地时间12月3日，谷歌宣布公司联合创始人拉里·佩奇(Larry Page)和谢尔盖·布林(Sergey Brin)将辞去母公司Alphabet首席执行官和总裁的职务。谷歌印度裔的首席执行官桑达尔·皮查伊(Sundar Pichai)将接任这两项职位。据了解，这一决定已经开始生效。消息公布后，Alphabet当天股价收盘时上涨约0.75％。谷歌在公开的文章中承认， 两位联合创始人的辞职也反映了佩奇和谢尔盖·布林在Alphabet中的作用日益减弱，这一决定是经过长期讨论的结果。两位联合创始人佩奇和布林在3号发布的一封公开博客文章中称，“尽管长期参与公司的日常管理一直是巨大的荣幸，但我们认为现在是时候承担起令人感到骄傲的父母角色了，我们会提供建议，保持对公司的关心，而不是每天唠叨。”两位创始人认为现在地简化公司管理结构的好时候，“当我们认为有更好的经营公司的方式时，就不会再担任管理职务了。Alphabet和谷歌也不需要两个CEO和一个总裁。”路透社文章称，佩奇和布林曾经是谷歌和Alphabet一些公共活动的常客，现在却已经很少见到他们了。据报道，两位联合创始人已经长期缺席公司具体业务的管理，而他们最近一次出席内部例会是在今年6月份。但佩奇和布林的离职不代表他们将完全脱手公司管理。根据Alphabet 2019股东大会公开信息显示，拉里·佩奇握有26.1%的投票权，布林握有25.2%的投票权，两位创始人的投票权相加超过50%，其对公司仍然有决策层面的控制权。佩奇在公开信的结尾表达了对于公司继续发展壮大的乐观态度，“我们提供了所有流行的消费者服务，例如地图和YouTube，我们的Android和Chrome平台与相关设备组成了全球生态系统。数十亿人选择使这些产品成为他们生活中不可或缺的一部分，这是对公司的一种荣誉。”但据公开信息显示，两位联合创始人在近年创立的自动驾驶公司Waymo和医疗保健软件公司Verily等被看做是公司重新发展的重要部分，目前这些新兴业务处于集体亏损的状态。拉里·佩奇拥有斯坦福大学计算机科学博士学位，在斯坦福求学期间，他与谢尔盖·布林成为了好友，并于1998年合作创办了谷歌。起初谷歌以其专利PageRank为基础给网页排名；1999年，谷歌开始正式作为搜索引擎推向市场；2000年发展成为全球最大的互联网引擎。2001年，佩奇辞去了谷歌CEO职位，十年后重掌谷歌。在佩奇的领导下，Android和YouTube都发展成规模可观的业务，并且开始研究无人驾驶、谷歌眼镜等项目。2015年，佩奇主持组建Alphabet，把旗下搜索、YouTube、其它网络子公司与研发投资部门分离开来。同年，桑达尔·皮查伊接替佩奇成为谷歌CEO。谢尔盖·布林出生于前苏联，是美国犹太裔计算机科学家。1995年，他在斯坦福大学新生欢迎会上结识了拉里·佩奇。布林在求学期间专注于数据挖掘系统，并开始和佩奇一起编写搜索引擎的程序。2015年，Alphabet组建后布林担任该公司总裁，并一直领导Google X实验室。这一实验室并没有公布业务情况与办公地点，但主持研发了谷歌眼镜、无人驾驶等大型项目。佩奇和布林宣布辞职后，47岁的谷歌CEO桑达尔·皮查伊随后向全体谷歌员工及时回应了这一事件。他在回信中称，实际上两位联合创始人给谷歌带来最重要的价值就是不断变化创新，而这一次的决定也将是非常正确的。皮查伊在公开信中对两位创始人表达了敬意，“我在2004年第一次见到佩奇和布林，从那时起我就一直在他们的指导和见解中受益。”皮查伊同时表示，两位联合创始人的成就与业绩将一直鼓励公司持续发展，“多亏了他们，我们拥有永恒的使命，持久的价值观以及协作与探索的文化，这使每天上班变得异常兴奋，这也是我们将继续发展的坚实基础。我已经等不及要看我们下一步将要做什么，并期待与大家继续前进。”
5G普及时代来了! 高通宣布骁龙765/765G/865移动平台,新酷产品第一时间免费试玩，还有众多优质达人分享独到生活经验，快来新浪众测，体验各领域最前沿、最有趣、最好玩的产品吧~！下载客户端还能获得专享福利哦！本文来自爱活网去年，太平洋的毛伊岛上，高通欣然宣布，2019将会是全球5G网络元年。如今一年过去，这句预言果然成为了现实，中国已成为全球第五个正式商用5G网络的国家，三大运营商纷纷上线5G商用套餐，而北美、欧洲的许多国家也已经提供了相应的5G服务。新一届的骁龙技术峰会又一次如约而至，在仍然酷热的夏威夷，高通依旧向所有人强调了5G网络的愿景——2019年才成为现实的5G网络，将会在2020年迎来真正的爆发！而在运营商以及OEM厂商的背后，高通全新的骁龙765系列移动平台以及高通骁龙865移动平台依旧会为全球合作伙伴，提供强而有力的技术支持。5G已成现实，DSS技术助力运营商更快普及5G5G不再是实验室的枯燥技术，而是真正能够改变我们生活的现实，这并不是一句空口无凭的话。高通分享了一大批数据以证明这一点，在2019年，已经有超过40个运营商开始部署5G，其中就包括中国移动、中国联通以及中国电信。现如今，中国三大运营商都已经正式开启5G网络的商用，它们纷纷提供了多个档位的5G网络套餐，只要你购买有支持5G网络的商用终端，已经能在中国主要城市 使用5G网络。而高通也预测，至2020年末，全球将会有超过2亿5G网络用户，而到2021年之后，全球5G连接将会超过28亿次，至此，全球将会迎来一个真正的5G爆发时代。就像前几年不断强调的那样，高通亦相信，5G不止6GHz以下的网络，它还包括毫米波连接。事实上，在推动6GHz以下网络部署的同时，全球各大先进的经济体也将部署毫米波网络，要做到这一点，就不得不提到DSS动态频谱共享技术。众所周知，频谱是无线网络的重要载体，随着越来越多频率被使用，频率资源的调度已经成为运营商头疼的问题，其中的矛盾也不断的上升，而DSS动态频率共享技术就能有效解决这一点。在过去，运营商可能需要将特定的频率用于不同的网络技术，而DSS动态频率共享能够帮助运营商在不同的网络间动态共享频谱，在同一频谱下同时提供不同（如4G以及5G）网络的支持。基于DSS动态频谱共享技术，65%的当前LTE基站可以同时提供5G网络，而未来运营商也同样可以在相同的硬件组件提供毫米波的支持。高通相信这将进一步加速5G网络的普及，也能让更多用户更快地用上5G网络。高通骁龙765/765G/865移动平台：全球化5G芯片提到骁龙与高通，普通人会首先在脑海中将它们与手机处理器相连接，这并没有错，因为高通的确是全球最大的智能手机芯片供应商，骁龙移动平台的名号已是无人不知无人不晓。事实上在5G元年，高通仍然处于领先的位置。目前，全球有超过230种5G终端正在使用高通骁龙芯片，它们不仅有智能手机，还包括了诸多商用设备。为了满足5G终端的需求，高通准备了全新的高通骁龙765/765G/865三大全新的移动平台，不过，骁龙技术峰会的首日Keynote并没有深入为我们解析高通骁龙的新品信息，它们都会在明天迎来正式的发布，不过心急的高通仍然提前向我们揭露了一些关键性的数据。首先是高通骁龙765/765G，作为首款提供5G网络终端的骁龙700系处理器，它们的目标自然是普及5G网络。高通在骁龙765/765G平台中内置了全新的X52调制解调器，它提供有SA/NSA双模支持，最高支持3.7Gbps下行速率。其次，高通骁龙865移动平台则定位在旗舰级市场，它将会内置有性能更强的X55调制解调器，提供2倍于高通骁龙855移动平台的AI处理能力，并且具备性能更强的CPU、GPU以及ISP。据悉，高通骁龙765系列以及高通骁龙865移动平台都将提供模块化设计，高通会提供更高集成的提供射频、芯片的整套解决方案，这将会提高OEM厂商的终端设计效率。三款全新的移动平台已经得到了OEM厂商的支持，首日Keynote上，高通就找来了摩托罗拉副总裁Sergio Buniac、小米创始人林斌、OPPO副总裁吴强以及HMD熟悉产品官Juho Sarvikas上台背书。其中，林斌宣布，小米首款搭载有高通骁龙865移动平台的终端小米10即将迎来发布，按照发布会的暗示来看，这部全新的旗舰也很可能会搭载与小米CC9 Pro相同的一亿像素模组，而基于高通骁龙865更强大的ISP性能，它的拍摄能力也将得到增强。除去小米10之外，小米也会提供超过10台不同定位的5G终端发布。此外，HMD、OPPO以及HMD都将新终端提上了日程。高通也欣然宣布，包括vivo、黑纱、iQOO、联想、努比亚、一加、realme、TCL、中兴在内的OEM厂商，都会在2020年发布搭载有高通骁龙765/765G/865移动平台的5G终端。高通预测，截止2022年，全球5G终端出货量将会超过14亿台。在终端之外，高通也在首日Keynote上推出了新一代超声波指纹传感器——3D Sonic Max。3D Sonic Max支持的识别面积是前一代的17倍，能够支持两个手指同时进行指纹认证，进一步提升了安全性，此外也提高了解锁速度和易用性。连接至上，5G普及时代到来！过去30年，高通一直致力于人与人的连接，现如今依靠智能终端强大的计算能力，我们已经实现了过去不可想象的许多体验，诸如货运仓储，能够实时的反映到管理人员的数据库，它令物流管理变得更容易；家用摄像头能够在手机上完成高清的画面传输，人脸识别算法令它仿佛成为24小时待命的家庭安保；而智能穿戴设备也随时监控着身体的健康，不止是日常记步，包括血压、血糖以及心率数据也能够直接查看。而在5G时代，过去这些习以为常的事都将变得更智能。（有关高通骁龙765系列以及高通骁龙865的具体信息，明天见！）
对标AirPods Pro：曝Galaxy Earbuds+将支持主动降噪,新酷产品第一时间免费试玩，还有众多优质达人分享独到生活经验，快来新浪众测，体验各领域最前沿、最有趣、最好玩的产品吧~！下载客户端还能获得专享福利哦！三星正在为其即将推出的智能手机Galaxy S11，S11 Plus和S11e进行最后润色，预计将在明年2月发布，届时这家韩国制造商还有望推出其第二代无线耳机，现在该耳机的信息已经曝光。爆料大神@evleaks 在推特透露，三星第二代Galaxy Earbuds将被称为Galaxy Earbuds +，而不是Galaxy Earbuds 2。evleaks的原话是：“首先是AirPods Pro…然后是Galaxy Buds +。”evleaks将其与苹果公司的AirPods Pro相比较，说明即将面世的Galaxy Buds +可能支持主动降噪。目前我们对Galaxy Buds +的了解并不多，但可以预期其价格与上一代产品应该接近。目前，Galaxy Earbuds的价格为129.99美元，因此，Galaxy Earbuds +的价格极有可能在150美元以下。
小米宣布将中国首发使用骁龙865和骁龙765G的手机,新酷产品第一时间免费试玩，还有众多优质达人分享独到生活经验，快来新浪众测，体验各领域最前沿、最有趣、最好玩的产品吧~！下载客户端还能获得专享福利哦！新浪手机 瑞豪新浪手机讯 12月4日上午消息，随着第四届高通骁龙技术峰会的召开，明年旗舰移动平台骁龙865和面向中端产品的骁龙765G移动平台也随之亮相。小米林斌也在会上宣布，小米是首发使用骁龙865和骁龙765的手机品牌，最快将在12月10见到。而林斌说的12月10日的新品正是Redmi红米K30系列。Redmi红米K30系列将搭载骁龙765G移动平台，它也是集成式5G移动平台——独有骁龙x52调制解调器-射频系统，支持毫米波和sub6、动态频谱共享DSS、standalone和非standalone、载波聚合。关于骁龙765G移动平台的详细参数将会在第二天揭晓。而旗舰级骁龙865，将在小米10首发。从骁龙技术峰会上，小米的暗示来看，这部全新的旗舰也很可能会搭载与小米CC9 Pro相同的一亿像素模组，而基于高通骁龙865更强大的ISP性能，它的拍摄能力也将得到增强。
罗技推出粉红色“狗屁王”G PRO W无线鼠标,新酷产品第一时间免费试玩，还有众多优质达人分享独到生活经验，快来新浪众测，体验各领域最前沿、最有趣、最好玩的产品吧~！下载客户端还能获得专享福利哦！据罗技官方消息，罗技正式推出粉红色G PRO wireless（外号“狗屁王”）鼠标，型号为“PIXEL”，售价为149.99美元（约合人民币1059元）。据了解，罗技粉红色的“PIXEL”鼠标其实是罗技G PRO wireless鼠标的粉红色版本，在外观和功能上和原版的GPW完全相同。官方表示今天是国际残疾人日（12月3日，美国当地时间），旨在促进人们对残疾问题的理解，并倡导一个具有包容、公平和充分实现残疾人权利的世界。罗技官方也推出限量版粉红色罗技G PRO无线游戏鼠标“PIXEL”。价格方面，粉红色的GPW鼠标售价为149.99美元（约合人民币1059元）；官方还表示“PIXEL”是限量版颜色系列的首批产品，目前仅在美国销售，接下来每个月都将推出全新的配色。
爆款已定！小米10发布时间确认：首发骁龙865,新酷产品第一时间免费试玩，还有众多优质达人分享独到生活经验，快来新浪众测，体验各领域最前沿、最有趣、最好玩的产品吧~！下载客户端还能获得专享福利哦！今天，高通在夏威夷骁龙年度峰会上正式发布两款全新骁龙5G移动平台：骁龙865、骁龙765G。小米集团联合创始人、副董事长林斌，在会上宣布：小米10将首发2020年度旗舰骁龙865！同时，Redmi品牌总经理卢伟冰在微博正式官宣：Redmi K30系列首发骁龙765G。在骁龙年度技术峰会上，高通总裁克里斯蒂安诺·阿蒙（Cristiano Amon）宣布5G将在2020年扩展至主流层级，让全球更多消费者能够享受5G数千兆的连接速度，作为高通8系列的最新旗舰产品，骁龙865定义了最新一代旗舰智能手机的性能和体验。另外，高通移动业务总经理阿力克斯·卡图赞介绍称：骁龙865在CPU、GPU、AI以及相机等多个方面都是Android阵营的第一名。骁龙865平台拥有两倍于之前的AI运算性能，甚至支持每秒最高2亿像素的图像运算能力，可支持 8K 30fps的视频录制。此次峰会之上，林斌宣布将于明年第一季度发布小米10，而作为小米十周年之际的旗舰作品，将成为首发骁龙865的智能手机。作为双品牌之一的Redmi，则成为此次高通另一款5G新品骁龙765G的首发手机品牌，并定档12月10日正式发布Redmi K30系列。Redmi K30系列将搭载高通骁龙765G移动平台，“G”意味着Gaming，是7系列的高性能版本。骁龙765G是高通最新一代5G移动平台，集成X52 Modem，支持SA/NSA 5G双模，下行峰值3.7Gbps。同时采用了第五代高通AIE人工智能引擎，拥有5TOPS的AI算力。近几年，小米MIX 2S首发骁龙845，小米9首发骁龙855，加上此次小米10首发骁龙865和Redmi K30首发骁龙765G，可以说小米包揽了高通最重要产品的首发。林斌表示，高通和小米是最重要的合作伙伴关系，采用高通移动平台的小米智能手机超过4.27亿。
