人物 | 苏炳添当选国际田联委员 “成就”超刘翔,11月18日，当中国田协发布消息称，苏炳添当选为国际田联运动员工作委员会委员，中国飞人已抵达美国，为东京奥运会开启冬训。这是中国首次有田径运动员当选该委员会委员，苏炳添能够进入国际田联任职，是国际田联对这位世界级飞人的认可。世界田径人投票认可北京青年报记者了解到，苏炳添是在今年多哈田径世锦赛前递交运动员委员竞选申请。在世锦赛期间历经竞选环节，最终由多哈世锦赛的全体参赛运动员进行投票产生。虽然这次多哈世锦赛苏炳添有男子百米和男子接力的任务，对于竞选，苏炳添也是格外重视。来到多哈前，苏炳添已准备好了竞选海报，以及一些竞选的小册子。在参加完100米的比赛后，苏炳添就在运动员餐厅，向各代表队的运动员分发，请他们多多支持。苏炳添能够成为世界田径运动员工作委员会委员，代表世界上成千上万的运动员，为运动员发声，他的成绩和能力得到了同场竞技的运动员的认可。9秒91用成绩说话本次新入选的委员有6个人，苏炳添是唯一亚洲男子百米跑者。他创造的9秒91亚洲纪录，为他加了重要的一分。本次入选国际田联运动员委员会委员的，还有肯尼亚女子3000米障碍选手米尔卡·切瓦、科特迪瓦女子短跑名将塔娄、叙利亚男子跳高选手加扎尔、哈萨克斯坦女子三级跳远选手奥尔加、南非短跑运动员希姆宾。2015年，苏炳添成为百米首位突破十秒大关的黄种人，创造了历史；2018年，苏炳添三次突破亚洲60米纪录，跑出了6秒42的成绩跻身史上第五位；在室外赛季他跑出了9秒91的亚洲新纪录，已经成为世界级的男子100米飞人。苏炳添的成绩，也带动身边的年轻新锐，甚至给了中国田径更大自信。中国田径进入世界大赛比较晚，近年进步明显。2019年多哈田径世锦赛，中国田径队以3金3银3铜的成绩排名第四位，仅次于世界田径强国美国队、肯尼亚队、牙买加队。运动员委员会不是“养老院”运动员委员会委员，是不是赠与顶级运动员的“退休福利”？对此国际田联运动员委员会主席伊纳基-戈麦兹予以解读：“通过治理改革，国际田联采取了积极但必要的措施，以有意义的方式加强决策过程中，更多听取运动员的声音。运动员应该认真把握这个机会，倡导和保护所有运动员的利益和权利。在成功当选委员后，苏炳添对外表示：“感谢世界田联、中国田径队的信任与支持！我会倍加珍惜这来之不易的机会，努力做好这份工作，不辜负大家的期望，为广大的运动员发声！”飞人目标奥运突破运动员委员会不是养老院，苏炳添也没有就此止步。眼下苏炳添和中国田径队短跑项目组已抵达美国，与外教亨廷顿一起，为了即将到来的东京奥运会开启冬训模式。新赛季的苏炳添，身上已经悄然打上了职业生涯末期的烙印。飞人也悄然入职暨南大学，评上了副教授的职称，还抽空给同学们上课，还在核心刊物体育科学上发表《新时代中国男子 100m短跑 回顾与展望》的文章，展示了自己作为一个老师的研究能力。而受到30岁年龄的影响，和本赛季腰背部伤病的影响，苏炳添本赛季发挥不如上赛季，百米本赛季最好成绩10秒05，今年的世锦赛上也没有延续自己连续闯进100m决赛的纪录。不过，苏炳添并未就此终止自己的职业生涯。来自世界的运动员，推选苏炳添进入国际田联运动员委员会，也正是看重苏炳添不断突破所代表的体育意义。随着苏炳添在与外教亨廷顿合作，一步步提升自己的成绩大关，到29岁依然可以三破亚洲60米纪录，两次以9秒91的成绩追平亚洲100米纪录。如今，苏炳添依然希望，通过高强度和高科技冬季训练，继续突破自己。今年冬训期，中国短跑队继续和著名教练亨廷顿合作。苏炳添也继续和谢震业，许周政，梁劲生，莫有雪等接力队友，远赴美国洛杉矶的训练营进行训练。据悉，中国选手们在训练间隙，还将在美国和欧洲参加比赛，为即将到来的奥运会找感觉。从22岁破全国纪录，到30岁仍在突破自己，苏炳添不断突破的精神，正契合田径的精神。这种精神带给中国体坛的意义，可能远远超越苏炳添的成绩本身。文/北京青年报记者 褚鹏
她2小时44分跑完首马 与李芷萱一起站上领奖台,刚刚结束的上海马拉松，来自广州的陈丽琴是第三个冲线的国内女选手，前两位分别是“一姐”李芷萱和西藏的未来之星次仁措姆。陈丽琴这次的净成绩为2小时44分20秒，在颁奖典礼上，她得以有机会与李芷萱和次仁措姆共同站上领奖台。相比其她两人，陈丽琴的名字似乎很少有人知道，毕竟上海的这场比赛，还只是她第一次跑全程项目。在首马跑出2小时44分的成绩，或许有人觉得陈丽琴是一位专业选手。实际上，作为90后，她从2016年才开始参加比赛，此前一直跑的是半马，两年多的时间一直在进步，去年在广州马拉松创造了1小时18分的半马PB。陈丽琴与跑步结缘还要从初中说起：“当时学校举行运动会，老师就叫我们参加，但报名的同学没几个，我是班干部，总得起到带头作用，经常会报跑步、跳远好几个项目。”在校运动会的跑步项目中，陈丽琴总能够拿到第一名，后来，学校的体育老师还时常带着她去参加区里面的运动会。升高中时，她听从老师的建议，以体育特招生的身份考入了重点中学。“当时我主要练400米和800米，但也不是每天都训练，就是等到要参加比赛的时候，才会提前练一两个月，平时也要正常上课。”现在回想起体育生的经历，陈丽琴总是反复说自己一点都不喜欢跑步，因为从小没有基础，练起来特别的辛苦，2009年高中毕业后，她就彻底的告别了跑步。从2015年起，跑步逐渐成为潮流，各地的跑团如雨后春笋般涌现出来，陈丽琴当时被朋友拉入了一个悦跑团，2016年欢乐跑中国10公里的比赛，她们一起报名参加。“当时听说前一站的冠军跑了43分钟，我也想测测自己是什么水平，我就在家附近自己跑了一个10公里，那时候也不懂心率什么的，反正跑的很累，大概50分钟跑完，整个人感觉快不行了。”2016年5月15日，陈丽琴迎来了自己的首个路跑赛事，她在欢乐跑10公里的比赛中跑出了44分34秒的成绩，夺得女子第三名。从这以后，她成为了跑团内的大明星，并获得了一个当年广州马拉松半马项目的名额。跑完欢乐跑后，她半年的时间没参加过比赛，第一次跑半马，陈丽琴心里也没底，她想试试看自己到底什么水平，于是，她又在赛前自测了一个21公里，并顺利跑进了2小时。“当时身边很流行半马破2，跑了一次之后我心里也有了底，2016年的广马半程我最终1小时33分完赛，拿到了女子第9。”由于平时要上班，还要照顾5岁大的孩子，陈丽琴很少出远门，她一般只选择广州周边的比赛参加。凭借2016广州半马的成绩，陈丽琴获得了参加2017广州马拉松的资格，在2017年的半马项目中，她跑出了1小时27分42秒的成绩，半马首次突破130。2018年，陈丽琴加入了石吉林在佛山举办的训练营，开启了系统训练的道路：“我住在广州与佛山的交界处，其实去参加训练营很不方便，但特别要感谢我的好朋友们，他们会一大早从顺德开车来接我，然后再一起去训练营训练。”18年夏天，石吉林要去高原训练，训练营就无法相继下去，当时，耐克正好开始组建黑马计划，陈丽琴就在朋友的“怂恿”下报了名，审核阶段，她在400米和5000米两项的测试中，都跑出个人最好成绩，成功入选了广州的黑马。在经历了石吉林训练营和广州黑马训练的洗礼后，陈丽琴的成绩得到了显著的提升，10月在梅州马拉松半程她跑出了1小时22分49秒的PB，11月的南山半马又把PB提升了24秒，12月9日的广州马拉松，低温来袭，主场作战的她跑出了1小时18分34秒的新高！跑了两年多的半马，在与黑马教练的沟通后，陈丽琴觉得是时候去挑战一下全马了。而今年过年后，北京、上海、广州的黑马都开启了上海马拉松的备战，陈丽琴也是其中一员。除了参加黑马的集体的训练，陈丽琴平时训练的时间非常有限，她早上7点要送女儿去学校上课，白天还要帮助老公照顾店里的生意，下午又要接孩子放学，她只能每天早上四五点钟起床跑一跑。她的月跑量一直不大，很少突破300，只有今年十月，在备战上马的冲刺阶段，她月跑量才首次超过300公里。赛前，广州黑马教练给她的评估是可以跑到2小时50分左右，但陈丽琴却一直很焦虑，生理期因此延后，正好赶在了比赛前夕才来。周日的比赛，她的队友娃总带着她跑，一直保持3分50秒左右的配速，但跑到11公里，她突然有些岔气，只能不断的捶着小腹，她也示意娃总稍微放慢速度，这才稍稍有些缓解。或许是因为天气太热，跑到37公里的时候，陈丽琴感到小腿有抽筋的迹象，她原来还打算加速，但为了保险起见，选择听从身体发出的信号，还是以稳为主。最后几公里，陈丽琴超过了两位女选手，其中一位夏雨雨貌似中暑了，她庆幸自己没有贸然加速，否则也有可能会跑崩。最终，她顺利冲过终点，成绩定格在了2小时44分，在首个全马中获得了国际女子第九，国内第三的好成绩。（kyrie）
扬马和上海半马定档4月19日 锡马升级为银标,国际田径官网公布2020年的白金和金银铜标赛事日历，除公布白金标赛事外，也公布了明年的赛事日期。扬州半马和上海半马同定档4月19日，再次撞期！同时上半马升级为国际铜标赛事；3月22日的无锡马升级为银标赛事；苏州金鸡湖半马升级为铜标，定档3月15日；黄河口（东营）马拉松定档4月26日，大连马拉松定档5月10日，营口鲅鱼圈马拉松定档5月10月，吉林马拉松定档6月21日。2020年的白金和金银铜标赛事日历截止到目前，国内的金银铜标赛事有：金标赛事：北京马拉松、上海国际马拉松赛、厦门马拉松、扬州鉴真国际半程马拉松赛、兰州马拉松、重庆国际马拉松赛、广州马拉松、黄河口（东营）国际马拉松赛、衡水湖国际马拉松、太原国际马拉松赛、深圳马拉松，杭州马拉松。银标赛事：大连马拉松、合肥马拉松、无锡马拉松。铜标赛事：南昌国际马拉松、武汉马拉松、欢乐跑中国10公里锦标赛、凉都·六盘水夏季国际马拉松赛、西昌邛海国际马拉松赛、常州西太湖国际半程马拉松、长沙国际马拉松、上合昆明国际马拉松、南京马拉松、上海半程马拉松、营口鲅鱼圈马拉松、吉林市马拉松、苏州金鸡湖半程马拉松。香港：渣打香港马拉松（金标）。台湾省：新北市万金石马拉松（银标），台北马拉松（铜标）。（门派）
10/10/10策略 能让马拉松跑者成绩更好吗？,马拉松比赛虽然体能占据着重要位置，但比赛策略也扮演着重要角色。目前，有一种流行的新策略，被称为10/10/10策略，跑者们不妨了解一下。所谓10/10/10策略，也就是把马拉松比赛分为三段，第一段和第二段距离都是10英里（约16.093公里），第三段距离是10公里。纽约的跑步教练耶斯·伍兹目前就是用这种方法来训练马拉松跑者的，她对此有着比较深刻的见解。第一段10英里这相当于马拉松比赛的开局阶段，对此，伍兹表示：“跑者需要有耐心，沉住气，最重要的是要控制好速度，比目标配速要略慢一些。”实际上，很多跑者控制不住起跑速度是很常见的事。特别是比赛经验不足的跑者，想通过起跑时的加速甩掉其他人，结果到后半程只能眼看着别人超越自己，因为自己已经筋疲力竭了。前10英里之所以要慢一些，也是让身体处在一个逐渐加热的过程，为后面的加速和体能储备奠定基础。第二段10英里对于中间的这10英里，伍兹表示跑者应该比较熟悉，因为这一段需要按照目标速度进行跑，也是跑者平时训练时已经习惯的速度。“这一段距离是跑者熟悉的节奏，感觉很合拍，因为在训练时就是这个速度。”伍兹说。在此期间，跑者的双腿感觉应该很好，因为毕竟才刚跑了10英里而已，而且速度略慢。虽然在这一段距离的速度略快，但也只是10英里。第三段10公里伍兹认为，最后的10公里不只是看跑者的体能情况，更重要的是要看跑者的内心，是否对自己充满信心，是否渴望取得好成绩。最后阶段需要跑者冲刺，不断地超越其他人，这是在前两段的基础上让自己闪耀的时刻，实现预定目标就是胜利。（42195m）
“跑步膝”保养秘籍：让关节年轻起来其实挺简单,跑步让人快乐， 跑步让人健康， 跑步让人精神抖擞！全世界有数亿的跑步爱好者，不停地在跑动中。而马拉松更是跑步达人的竞技，每年赛事遍布世界各地。可惜， 关节疼往往是兴趣的杀手， 多少人长跑半生， 突然一天惊觉关节有伤！长期的运动给我们带来健康的同时， 也给关节带来不同程度的过载直到伤害。跑步的负重主要在膝盖和臀部的关节。2017年6月期《美国骨科与运动物理治疗杂志》根据实验得出， 慢跑有益关节健康。但另一个值得关注的是，竞技跑人群， 比如职业运动员、 高水平业余跑者和经常参加竞技性马拉松比赛的跑者， 他们中骨性关节炎患病率高达13.3%，比慢跑人群高出4倍， 说明长时间高强度和大运动量的跑步容易导致骨性关节炎的发生。膝关节损伤是跑步运动中最常见的损伤，85%的跑步者，或迟或早都会出现膝关节问题。马拉松爱好者陈先生说：跑了几年后，我是感觉膝关节越来越容易酸痛。陈先生爱好马拉松竞赛， 他的切身体会也很多。陈先生说圈内跑马拉松朋友多少都有些关节疼痛，但大家热爱马拉松竞跑， 放弃不跑是很难的。欣慰是的，一个偶然机会，陈先生认识了定居德国的邱女士，由此认识到世界先进的关节保健和关节炎康复知识。邱女士从专业角度介绍了营养对运动的关节的重要性：就跑步本身， 其动作是有利于把营养带给关节和排出关节腔内的废液， 减少炎症的发生。但跑步对关节的负载是正常走路的4倍，也就是对关节的“减震”功能要求更高，这就对起减震功能的关节滑液的质量和数量要求更高， 而滑液的主要成份透明质酸更是不容忽视的一个关键营养素。透明质酸的超强的锁水能力使滑液拥有减震功能。如果我们能及早的预防， 有意识的给关节补充营养， 就有可能避免关节炎的病疼，免去疼痛时服用不利身体健康的止疼药，免去带着风险的直接注射透明质酸和开刀治疗等等。科学地认识透明质酸我们的身体对透明质酸（HA）并不陌生。它是存在于人体的自然物质，它分布在身体的结缔组织和关节滑液中。透明质酸在关节中具有特别重要的作用，是影响关节滑液粘度和润滑性能的主要因素。在软骨中，透明质酸作为聚集蛋白聚糖的骨架，与核心营养素和蛋白结合，搭建起维护关节灵活和健康的基础。透明质酸是关节滑液的主要成份上世纪70年代，拜耳实验室就开始了对透明质酸的研究。实验数据显示，健康和年轻的身体，可以生成大约16克的透明质酸，满足身体的需要，同时，每天大约有三分之一进行新陈代谢。16克的透明质酸在人体内的分布为：●大约50%的透明质酸的存储在皮肤和骨骼的结缔组织●另外50%的大部分存储在关节滑液中●小部分分布在全身筋膜系统的结缔组织大约25岁起，透明质酸随着年龄的增长不在积极合成，40岁时，身体只有不到50%的含量，而60岁时，只有低于10%的透明质酸。透明质酸在人体的分布，决定了它在关节、肌肤和筋膜系统的三大功能。然而，随着年龄的增长， 人体生成透明质酸的能力快速下降。人到中年，身体已经极其缺乏透明质酸， 然而，透明质酸无法直接从常规食物中获取，需要从营养补充品中补充身体缺少的透明质酸。同时，缺乏透明质酸，是我们衰老的原因之一，不仅是皮肤失去弹性，涌现皱纹，皮肤容易失去水分，全身筋膜容易僵硬，增加身体部位的疼痛，关节也同时出现疼痛无力等。运动人群，特别是跑步人群，更特别的是追求跑步成绩的人群，需要更加充足的透明质酸和更多的关节营养，以支持关节接受运动过程中的强烈冲击力和过度的负载！（跑步吧）
每天跑步十公里真的科学吗 请放下对长距离的执念,对很多跑者来说，10公里是一个神圣的距离。刚开始跑的时候10公里有点望尘莫及，而坚持跑步一年以上时，十公里就成了每天的标配。不管是初入马拉松圈的跑步小白，还是马拉松国家一级以上的高手，都离不开一个衡量数据——跑量。于是很多跑者就由十公里开启了马拉松。顺利完赛的表现，强大的耐力，坚持跑步的毅力……都是通过跑量的积累来实现的，从2公里都喘到每天10公里，是一位跑者能力上质的飞跃。但是，每天坚持十公里，甚至更长的距离，真的适合我们吗？数据显示，随着跑量到达一定程度，我们往往会进入两个怪圈——要么，身体不断出现小毛病，腿酸脚疼，膝盖吃力；要么就是，当身体适应了这种强度的训练之后，效果就会递减趋势，甚至会事倍功半，陷入成绩瓶颈期。这样的体验大大打击了我们的积极性，辛辛苦苦堆的跑量，难道都没用？并不，只是你的观念该更新啦！举个例子，日本的一位60~64岁年龄组马拉松世界纪录保持者——Yoshihisa Hosaka，他每天累计跑量30多公里，但是从来不是一次拉完长距离。他更喜欢高强度拆分长距离，这种训练模式，不仅让他健康跑了数十年，也让他在45岁时创造了个人最好成绩，2小时25分，60岁甚至跑出了该年龄组的世界纪录！换句话说，高效的堆跑量，是建立在训练模式不断周期性变化，长期坚持的基础上的，而不是单纯的LSD，跟自己的身体拉锯。跑出科学的长距离需要注意以下几点1：控制跑步心率和速度距离跑的步速取决于你现在较短距离跑的步速和你马拉松的目标时间。如果你是跑步新手或正在准备自己的首马，那么你主要的目标应该是完成比赛，而没有必要设定一个具体时间目标。别以为快就是好，最好的强度应该比你的马拉松目标配速还要慢10%—20%左右，控制在最大心率的74%—84%，这样的配速才是最有效率的长距离跑。2：遵循增加跑量的原则在平时增加跑量时，我们要遵循以下3个原则：①。 一步一步来，每周增加的跑量宜在10%左右。②。跑量增加越多，越应该提前熟悉详尽的路况，包括厕所的位置等等细节……毕竟，长距离跑是以提高身体的耐力和跑长距离的能力为目的，而不是以提高跑步困难程度为目的。③：不要盲目学习大神，一旦有身体不适，就要减少增量，循序渐进。3：营养和休息，非常重要在跑长距离和马拉松时，身体急需碳水化合物（糖）、电解质（盐）以及冷却系统（水）。你可以在跑前 1小时喝一瓶运动饮料，再吃一根能量棒和一根香蕉。然后在跑步中，每45到60分钟就吃一根能量胶，并喝水。如果距离超过20公里，接近马拉松，那么跑完后的30分钟内，除了注意补充碳水化合物，吃上一根香蕉，最好再喝上一瓶运动饮料。最后，良好的睡眠是肌肉恢复的重要步骤，休息一定要到位：不要让跑量多少变成奴役自己的工具，能完成多少就完成多少，不需强求，没有休息的堆积跑量只会让身体出现问题。长距离训练并非跑步的必需品如果跑步仅仅是你的业余生活，那每周慢跑3次，每次跑半小时就足够了。专业运动员多多少少都会出现伤病就是因为强度太大。有很多跑步者，尤其是竞技型跑者，直到受伤，才意识到身体舒适度是多么重要，快速奔跑和长距离后的酣畅淋漓，对于一些跑者来说很难割舍，但是它却能换来更长久的跑步历程。如果你对马拉松没有执念，就尽管用放松的心态去慢跑吧，长距离并非跑步的必需品，能跑多远不重要，坚持一直在运动，从不放下跑步，让它融入你的生活，才是最重要的。毕竟，慢跑的好处太多了：它是锻炼心血管系统的有效训练方式；它能够减少骨骼受伤的风险；缩短身体机能的恢复时间；增加肌肉中毛细血管的数量，从而提高血液流通；增加肌肉中的氧气储备；增强免疫系统；增加线粒体数量，增大线粒体体积；消耗热量，其中大部分是脂肪代谢；缓解压力，让身体变轻松；摄取更多氧气，有时间放松和思考……来源：这里是咕咚（ID：codooncom）
